{
  "id": "AVD-AZU-0003",
  "apiVersion": 2,
  "version": 1,
  "title": "Web App uses the latest HTTP version",
  "description": "Use the latest version of HTTP to ensure you are benefiting from security fixes",
  "custom": {
    "severity": "LOW",
    "possibleImpact": "Outdated versions of HTTP has security vulnerabilities",
    "references": [],
    "externalToolIds": {
      "cfsec": [],
      "cspm": [
        {
          "id": 421,
          "name": "appservice/http20Enabled"
        }
      ],
      "tfsec": [
        "azure-appservice-enable-http2"
      ]
    }
  }
}