{
  "id": "AVD-AWS-0055",
  "apiVersion": 2,
  "version": 1,
  "title": "IAM customer managed policies should not allow decryption actions on all KMS keys",
  "description": "IAM policies define which actions an identity (user, group, or role) can perform on which resources. Following security best practices, AWS recommends that you allow least privilege. In other words, you should grant to identities only the kms:Decrypt or kms:ReEncryptFrom permissions and only for the keys that are required to perform a task.",
  "custom": {
    "severity": "HIGH",
    "possibleImpact": "Identities may be able to decrypt data which they should not have access to",
    "references": [
      {
        "title": "title",
        "url": "https://docs.aws.amazon.com/securityhub/latest/userguide/securityhub-standards-fsbp-controls.html#fsbp-kms-1"
      }
    ],
    "externalToolIds": {
      "cfsec": [
        "aws-iam-block-kms-policy-wildcard"
      ],
      "cspm": [],
      "tfsec": [
        "aws-iam-block-kms-policy-wildcard"
      ]
    }
  }
}