{
    "id": "AVD-GCP-0003",
    "apiVersion": 2,
    "version": 1,
    "title": "Encrypted compute disk with unmanaged keys.",
    "description": "By default, Compute Engine encrypts all data at rest. Compute Engine handles and manages this encryption for you without any additional actions on your part.\n\nIf the disk_encryption_key block is included in the resource declaration then it *must* include a raw_key or kms_key_self_link.",
    "custom": {
        "severity": "HIGH",
        "possibleImpact": "Encryption of disk using unmanaged keys.",
        "references": [
            {
                "title": "Encrypt disks with customer-supplied encryption keys",
                "url": "https://cloud.google.com/compute/docs/disks/customer-supplied-encryption"
            }
        ],
        "externalToolIds": {
            "cfsec": [],
            "cspm": [
                {
                    "id": 643,
                    "name": "compute/csekEncryptionEnabled"
                }
            ],
            "tfsec": [
                "google-compute-disk-encryption-customer-keys"
            ]
        }
    }
}