{
    "id": "AVD-AZU-0041",
    "apiVersion": 2,
    "version": 1,
    "title": "An inbound network security rule allows traffic from /0.",
    "description": "Network security rules should not use very broad subnets.\n\nWhere possible, segments should be broken into smaller subnets.",
    "custom": {
        "severity": "CRITICAL",
        "possibleImpact": "The port is exposed for ingress from the internet",
        "references": [
            {
                "title": "Best practices for network security",
                "url": "https://docs.microsoft.com/en-us/azure/security/fundamentals/network-best-practices"
            }
        ],
        "externalToolIds": {
            "cfsec": [],
            "cspm": [],
            "tfsec": [
                "azure-network-no-public-ingress"
            ]
        }
    }
}