{
  "id": "AVD-GCP-0054",
  "apiVersion": 2,
  "version": 1,
  "title": "Disable local_infile setting in MySQL",
  "description": "Arbitrary files can be read from the system using LOAD_DATA unless this setting is disabled.",
  "custom": {
    "severity": "HIGH",
    "possibleImpact": "Arbitrary files read by attackers when combined with a SQL injection vulnerability.",
    "references": [
      {
        "title": "title",
        "url": "https://dev.mysql.com/doc/refman/8.0/en/load-data-local-security.html"
      }
    ],
    "externalToolIds": {
      "cfsec": [],
      "cspm": [
        {
          "id": -1,
          "name": "TODO-CSPM-PLUGIN-NAME"
        }
      ],
      "tfsec": [
        "google-sql-mysql-no-local-infile"
      ]
    }
  }
}