{
  "id": "AVD-AWS-0034",
  "apiVersion": 2,
  "version": 1,
  "title": "ECS clusters should have container insights enabled",
  "description": "Cloudwatch Container Insights provide more metrics and logs for container based applications and micro services.",
  "custom": {
    "severity": "LOW",
    "possibleImpact": "Not all metrics and logs may be gathered for containers when Container Insights isn't enabled",
    "references": [
      {
        "title": "title",
        "url": "https://docs.aws.amazon.com/AmazonCloudWatch/latest/monitoring/ContainerInsights.html"
      }
    ],
    "externalToolIds": {
      "cfsec": [
        "aws-ecs-enable-container-insight"
      ],
      "cspm": [
        {
          "id": -1,
          "name": "TODO-CSPM-PLUGIN-NAME"
        }
      ],
      "tfsec": [
        "aws-ecs-enable-container-insight"
      ]
    }
  }
}