{
  "id": "AVD-AWS-0037",
  "apiVersion": 2,
  "version": 1,
  "title": "EFS Encryption has not been enabled",
  "description": "If your organization is subject to corporate or regulatory policies that require encryption of data and metadata at rest, we recommend creating a file system that is encrypted at rest, and mounting your file system using encryption of data in transit.",
  "custom": {
    "severity": "HIGH",
    "possibleImpact": "Data can be read from the EFS if compromised",
    "references": [
      {
        "title": "title",
        "url": "https://docs.aws.amazon.com/efs/latest/ug/encryption.html"
      }
    ],
    "externalToolIds": {
      "cfsec": [
        "aws-efs-enable-at-rest-encryption"
      ],
      "cspm": [
        {
          "id": -1,
          "name": "TODO-CSPM-PLUGIN-NAME"
        }
      ],
      "tfsec": [
        "aws-efs-enable-at-rest-encryption"
      ]
    }
  }
}