{
    "id": "AVD-GCP-0031",
    "apiVersion": 2,
    "version": 1,
    "title": "Legacy metadata endpoints enabled.",
    "description": "The Compute Engine instance metadata server exposes legacy v0.1 and v1beta1 endpoints, which do not enforce metadata query headers. \n\nThis is a feature in the v1 APIs that makes it more difficult for a potential attacker to retrieve instance metadata. \n\nUnless specifically required, we recommend you disable these legacy APIs.\n\nWhen setting the metadata block, the default value for disable-legacy-endpoints is set to true, they should not be explicitly enabled.",
    "custom": {
        "severity": "HIGH",
        "possibleImpact": "Legacy metadata endpoints don't require metadata headers",
        "references": [
            {
                "title": "Hardening your cluster's security",
                "url": "https://cloud.google.com/kubernetes-engine/docs/how-to/hardening-your-cluster#protect_node_metadata_default_for_112"
            }
        ],
        "externalToolIds": {
            "cfsec": [],
            "cspm": [],
            "tfsec": [
                "google-gke-metadata-endpoints-disabled"
            ]
        }
    }
}