{
  "id": "AVD-AWS-0100",
  "apiVersion": 2,
  "version": 1,
  "title": "Ensures that usage of security groups with inline rules and security group rule resources are not mixed.",
  "description": "Mixing Terraform standalone security_group_rule resource and security_group resource with inline ingress/egress rules results in rules being overwritten during Terraform apply.",
  "custom": {
    "severity": "LOW",
    "possibleImpact": "Security group rules will be overwritten and will result in unintended blocking of network traffic",
    "references": [],
    "externalToolIds": {
      "cfsec": [
        "aws-vpc-disallow-mixed-sgr"
      ],
      "cspm": [
        {
          "id": -1,
          "name": "TODO-CSPM-PLUGIN-NAME"
        }
      ],
      "tfsec": [
        "aws-vpc-disallow-mixed-sgr"
      ]
    }
  }
}