{
    "id": "AVD-AZU-0026",
    "apiVersion": 2,
    "version": 1,
    "title": "Unencrypted data lake storage.",
    "description": "Datalake storage encryption defaults to Enabled, it shouldn't be overridden to Disabled.",
    "custom": {
        "severity": "HIGH",
        "possibleImpact": "Data could be read if compromised",
        "references": [
            {
                "title": "Overview of security in Azure Data Lake Storage Gen1",
                "url": "https://docs.microsoft.com/en-us/azure/data-lake-store/data-lake-store-security-overview"
            }
        ],
        "externalToolIds": {
            "cfsec": [],
            "cspm": [],
            "tfsec": [
                "azure-datalake-enable-at-rest-encryption"
            ]
        }
    }
}